{
  "schemaVersion": 1,
  "project": {
    "name": "Migration golden fixture",
    "profile": "Express",
    "executionMode": "Gated"
  },
  "state": {
    "stage": 9,
    "status": "In progress",
    "activeInputs": ["SRC-REPO-001"],
    "currentTask": null,
    "latestOutput": null
  },
  "snapshots": [
    {
      "id": "SRC-REPO-001",
      "role": "Input baseline",
      "pinStrength": "Immutable",
      "status": "Active",
      "reference": ".",
      "commit": "1111111111111111111111111111111111111111"
    }
  ],
  "artifacts": [
    {
      "id": "ART-WORKPACK",
      "type": "WORKPACK",
      "status": "Approved",
      "baseline": ["SRC-REPO-001"],
      "references": ["REQ-FR-001", "SPEC-BEH-001", "AC-001", "PLAN-001"]
    }
  ],
  "tasks": [
    {
      "id": "P01-T01",
      "status": "Ready",
      "baseline": "SRC-REPO-001",
      "prerequisites": [],
      "references": ["PLAN-001"],
      "output": null,
      "validation": [
        {
          "name": "Legacy manual review",
          "status": "Passed",
          "evidence": "Legacy reviewer recorded a pass"
        }
      ]
    }
  ]
}
